Campus,Department,Study Language,Study Method,Duration,Entry Requirements,English Level,Course Fees,Location,Career Opportunities,Course,URL
ICBT,Information Technology,English,Full Time / Part Time,1 Year,"Relevant HND or any other equivalent qualification (subject to case-by-case approval). Applicants should demonstrate English proficiency for academic studies.
",Intermediate,,"Colombo, Batticaloa, Gampaha, Kurunegala, Nugegoda
","IT Project Manager, Systems Analyst, Business Systems Developer, Database Administrator, Software Engineer, IT Consultant
",BSc (Hons) in Information Technology,https://icbt.lk/courses/bsc-hons-in-information-technology/
ICBT,Science ,English,Full Time / Part Time,1 Year,"Diploma in Nursing and current nurse registration/license to practice as a Nurse. G.C.E. Ordinary Level English or any other equivalent qualification.
",Intermediate,,"Anuradhapura, Batticaloa, Colombo, Galle, Gampaha, Jaffna, Kandy, Kurunegala
","Registered Nurse, Clinical Nurse Specialist, Nursing Officer, Healthcare Administrator, Public Health Nurse, Nurse Educator
",BSc (Hons) in Nursing,https://icbt.lk/courses/bsc-in-nursing/
ICBT,Science ,English,Full Time / Part Time,1 Year,"Diploma in Nursing and current nurse registration/license to practice as a Nurse. G.C.E. O/L English or any other equivalent qualification.
",Intermediate,,"Anuradhapura, Batticaloa, Colombo, Galle, Gampaha, Jaffna, Kandy, Kurunegala
","Registered Nurse, Nursing Officer, Clinical Supervisor, Nursing Educator, Healthcare Administrator
",BSc (Hons) in Psychology,https://icbt.lk/courses/bsc-hons-in-psychology/
ICBT,Science ,English,Full Time,1 Year,"HND in Biomedical Science or any other equivalent qualification (case by case approval). Required documents: Curriculum Vitae, Academic and professional qualifications, Passport or National Identity Card, Service letter.
",Intermediate,,Colombo,"Biomedical Scientist, Laboratory Analyst, Clinical Research Associate, Medical Laboratory Technician, Research Scientist
",BSc (Hons) in Biomedical Science,https://icbt.lk/courses/bsc-hons-in-biomedical-science/
ICBT,English,English,Full Time,1 Year,"Higher Diploma in English (Cardiff Metropolitan University) or any equivalent Level 05 English qualification acceptable to the academic board.
",Intermediate,,"Anuradhapura, Colombo","English Language Teacher, Content Writer, Editor, Curriculum Designer, ELT Specialist, Academic Researcher
",BA (Hons) in English,https://icbt.lk/courses/ba-hons-in-english/
CINEC,Faculty of Maritime Sciences(Department of Navigation),English,Full Time,3 Years,"Credit pass for English in GCE Ordinary Level Examination or equivalent; Completion of GCE Advanced Level with 03 passes in Physical Sciences stream, Biological Sciences stream with a pass for Physics, Engineering Technology stream, or Science for Technology stream; or any other equivalent or higher qualification approved by the Ministry of Higher Education; Successful interview conducted by CINEC; Pass Medical Fitness and Sight Test to the satisfaction of the college administration
",Intermediate,,Colombo ,"Merchant Navy Deck Officer, Ship Navigation Officer, Shipping Industry Manager, Port Operations Officer
",BSC in Maritime Operations - Ministry of Education / UGC Approved,https://www.cinec.edu/courses/bsc-in-maritime-operations.html
CINEC,Faculty of Management and Social Sciences,English,Full Time,4 Years,"Passed GCE A/L examination with three (03) passes in any Scheme or any other qualification of comparable standing recognized by UGC of Sri Lanka such as Edexcel/Cambridge with three (03) passes
",Intermediate,,Colombo ,"Travel companies and Tour operators, Hotels and Resorts Management, Event management, Cruise companies, Airline, railway travel and passenger services, Banquets, Conferences and conventions centers, Tourist offices and ministries of tourism, Food and Beverage Management, Concert and theatre venues, Museums and cultural venues, Manufacturers and suppliers of hospitality equipment, Spa and Wellness Management, Consulting and Academic
",Bachelor of Management Honours in Tourism and Hospitality Management - Ministry of Education / UGC Approved,https://www.cinec.edu/courses/bmgt-hons-in-tourism-and-hospitality-management.html
CINEC,Faculty of Management and Social Sciences,English,Full Time,4 Years,"G. C. E. A/L Any Stream 3S passes (Local) or Any other qualification of comparable standing recognized by UGC of Sri Lanka such as Pearson-Edexcel/Cambridge with three passes in any stream
",Intermediate,,Colombo ,"Manufacturing organizations, Services and marketing firms, Airports & Seaports, Logistics Companies, Multimodal Transportation Companies, Shipping Companies, Freight Forwarding Companies, Cargo Surveying Consultancy Agencies, Research Organizations
",Bachelor of Management Honours in Supply Chain Management - Ministry of Education / UGC Approved,https://www.cinec.edu/courses/bsc-hons-in-supply-chain-management.html
CINEC,Faculty of Management and Social Sciences,English,Full Time,4 Years,"G.C.E. A/L Any Stream: 3 S passes / 2 C passes (Local) for main subjects, or any other qualification of comparable standing recognized by DMU such as Edexcel/Cambridge with three passes for main subjects in any stream, or successful completion of Undergraduate Foundation of CINEC
",Intermediate,,Colombo ,"Research and financial analysts, Corporate finance executives, Investment banking executives; employment in finance companies, commercial banks, investment and merchant banks, stock brokering companies, primary dealers, insurance companies, venture capital firms, fund management companies, unit trusts, pension funds, and corporate finance divisions of other organizations
",Bachelor of Science in International Transportation Management and Logistics (ITML) - Dalian Maritime University (DMU) – UGC Recognized,https://www.cinec.edu/courses/bsc-international-transportation-management-and-logistics-itml.html
CINEC,Faculty of Management and Social Sciences,English,Full Time,4 Years,"Passed GCE (Advanced Level) examination with three passes in any stream, or any other qualification of comparable standing recognized by UGC of Sri Lanka such as Edexcel/Cambridge with three passes in any stream

",Intermediate,,Colombo ,"Research and financial analysts, Corporate finance executives, Investment banking executives; employment opportunities in finance companies, commercial banks, investment and merchant banks, stock brokering companies, primary dealers, insurance companies, venture capital firms, fund management companies, unit trusts, pension funds, and corporate finance divisions of organizations locally and internationally
",Bachelor of Management Honours in Human Resource Management - Ministry of Education / UGC Approved,https://www.cinec.edu/courses/bmgt-hons-in-human-resource-management.html
CINEC,Faculty of Management and Social Sciences,English,Full Time,4 Years,"G.C.E. A/L any stream with three passes for main subjects (Local), or any other qualification of comparable standing recognized by UGC of Sri Lanka such as Edexcel/Cambridge with three passes for main subjects in any stream
",Intermediate,,Colombo ,"Account Manager, Financial Accountant, Budget Analyst, Tax Examiner, Financial Advisor
",Bachelor of Business Management Honours in Accounting - Ministry of Education / UGC Approved,https://www.cinec.edu/courses/bbm-hons-in-accounting.html
CINEC,Faculty of Management and Social Sciences,English,Full Time,4 Years,"Those who have passed GCE (Advanced Level) examination with three passes in any stream, or any other qualification of comparable standing recognized by UGC of Sri Lanka such as Edexcel/Cambridge with three passes in any stream
",Intermediate,,Colombo ,"Management trainees, management assistants in business administration or specific functional areas; potential career growth to general managers, directors, managers in sales and business development, Head-Business Operations, project manager, business analyst, supply chain planner, entrepreneurs
",Bachelor of Management Honours in Business Administration - Ministry of Education / UGC Approved,https://www.cinec.edu/courses/bmgt-hons-in-business-administration.html
CINEC,Faculty of Management and Social Sciences,English,Full Time,4 Years,"G. C. E A/L Any Stream 3S passes (Local) or any other qualification of comparable standing recognized by UGC/MoE of Sri Lanka such as Pearson / Cambridge with three passes in any stream
",Intermediate,,Colombo ,"Management executives in global branding organizations, supermarket chains, advertising and consumer marketing firms, manufacturing organizations, services marketing firms, research organizations, hotels, television, promotional and mass media
",Bachelor of Business Management Honours in Marketing - Ministry of Education / UGC Approved,https://www.cinec.edu/courses/bsc-hons-in-retail-marketing-and-branding.html
CINEC,Faculty of Management and Social Sciences,English,Full Time,4 Years,"Those who have passed GCE (Advanced Level) examination with three passes in any stream, or any other qualification of comparable standing recognized by UGC of Sri Lanka such as Edexcel/Cambridge with three passes in any stream
",Intermediate,,Colombo ,"Employment opportunities in production, operations, quality assurance, and purchasing sectors; roles such as Industrial Engineer, Operations Manager, Quality Controller, and Process Analyst
",Bachelor of Management Honours in Industrial Management - Ministry of Education / UGC Approved,https://www.cinec.edu/courses/15461-2.html
CINEC,Faculty of Health Sciences,English,Full Time,4 Years,"Three (3) simple passes (“S”) in Chemistry or Science for Technology, and any two of the following subjects: Biology, Physics, Agricultural Science, Bio Systems Technology, Engineering Technology, Agro Technology, Bio-Resource Technology, or Food Technology in one and the same sitting at the G.C.E. (Advanced Level) Examination conducted by the Department of Examinations of Sri Lanka or an equivalent qualification.
",Intermediate,,Colombo ,"Employment opportunities in Manufacturing, Quality Control/Quality Assurance, Regulatory Affairs, Research and Development, Formulation Development, Sales & Marketing, Academia, and Entrepreneurship.
",Bsc. (Hons) Industrial Pharmaceutical Sciences,https://www.cinec.edu/courses/bsc-in-industrial-drug-science.html
CINEC,Faculty of Health Sciences,English,Full Time,4 Years,"Three (3) simple passes (“S”) in Chemistry or Science for Technology and any two of the following subjects: Biology, Physics, Agricultural Science, Bio Systems Technology, Engineering Technology, Agro Technology, Bio-Resource Technology, or Food Technology in the same sitting at the G.C.E. (Advanced Level) Examination conducted by the Department of Examinations of Sri Lanka or an equivalent qualification.
",Intermediate,,Colombo ,"Employment opportunities in Manufacturing, Quality Control/Quality Assurance, Research and Development, Formulation Development, and Entrepreneurship.
",Bsc. (Hons) Cosmetic Science,https://www.cinec.edu/courses/bsc-in-cosmetic-science.html
CINEC,Faculty of Health Sciences,English,Full Time,4 Years,"Three (3) simple passes (“S”) for Biology, Chemistry, and Physics or Agricultural Science in one and the same sitting at the G.C.E. (Advanced Level) Examination conducted by the Department of Examinations of Sri Lanka or an equivalent qualification.
",Intermediate,,Colombo ,"Biomedical Scientist, Biotechnologist, Forensic Scientist, Healthcare Scientist in Clinical Biochemistry, Genomics and Haematology, Medicinal Chemist, Microbiologist, Research Scientist (Medical), Toxicologist.
",Bsc. (Hons) Biomedical Sciences,https://www.cinec.edu/courses/bsc-in-biomedical-sciences.html
CINEC,Faculty of Health Sciences,English,Full Time,4 Years,"Successfully completed General Certificate of Education (G.C.E.) Advanced Level (A/L) with three passes in the same sitting in Science stream (Biological Sciences, Physical Sciences or Technology stream), OR successfully completed Cambridge A/L, Edexcel (Pearson) A/L, or International Baccalaureate (IB) in Bio Science, Physical Science, or Technology stream, with at least three “S” grades in approved subjects.
",Intermediate,,Colombo ,"Pharmaceutical Sales Manager, Pharmaceutical Regulatory Manager, Clinical Trial Monitoring Executive, Pharmacovigilant Scientist, Pharmaceutical Business Development Manager
",BSc (Hons) in Medical and Health Product Management,https://www.cinec.edu/courses/bsc-hons-in-medical-and-health-product-management.html
CINEC,Faculty of Humanities and Education,English,Full Time,4 Years,"Bachelor of Education in Information Technology (Honours) Degree adheres to the minimum entry qualification of three (03) ‘S’ passes in any subject stream in one and the same sitting at the G.C.E. (Advanced Level) Examination or equivalent.
",Intermediate,,Colombo ,"Teaching (both in Sri Lanka and abroad), Lecturing (both in Sri Lanka and abroad), Educational Management, and other academic-related disciplines.
",Bachelor of Education (Honours) in Information Technology - Ministry of Education / UGC Approved,https://www.cinec.edu/courses/bachelor-of-education-honours-in-information-technology.html
CINEC,Faculty of Humanities and Education,English,Full Time,4 Years,"Three simple passes (3 Ss) in any subject stream at the G.C.E. Advanced Level with minimum school-level achievements or zonal-level participation in sports.
",Intermediate,,Colombo ,"Physical Education Teacher, Sports Instructor, Sports Coach, Sports Administrator, Fitness Trainer, School Sports Coordinator, Lecturer, Youth Service Officer, Sports Development Officer.
",Bachelor of Education (Honours) in Sports and Physical Education - Ministry of Higher Education Approved,https://www.cinec.edu/courses/bachelor-of-education-honours-in-sports-and-physical-education.html
CINEC,Faculty of Information Technology,English,Full Time,3 Years,"G.C.E. A/L in any stream with 1C and 2S passes (Local) or 1C and 2D passes (London) plus 5 Credit Passes at O/L (Local or London) including Credits for Mathematics, Science, and English. OR Foundation with 5 Credit Passes for O/L (Local or London) including Credits for Mathematics, Science, and English. OR any other qualification approved by the University of Wolverhampton.
",Intermediate,,Colombo ,"Software Developer, Programmer, Software Engineer, Systems Engineer, Quality Assurance Specialist.
","BSc (Hons) Computer Science (Software Engineering) - University of Wolverhampton, United Kingdom",https://www.cinec.edu/courses/bschons-computer-science-software-engineering.html
CINEC,Faculty of Information Technology,English,Full Time,4 Years,"Three (3) simple passes (‘S’) in the Physical Science subject stream in one and the same sitting at the G.C.E (Advanced Level) Examination or equivalent; OR three (3) simple passes (‘S’) in any subject stream in one and the same sitting at the G.C.E (Advanced Level) Examination with a bridging course developed by the Ministry of Higher Education (MoHE).
",Intermediate,,Colombo ,"Software Engineer, Software Developer, Web Developer, Mobile Application Developer, Database Administrator, Project Manager, IT Consultant, Software Quality Assurance Engineer.
",BSc (Hons) in Software Engineering - Ministry of Education / UGC Approved,https://www.cinec.edu/courses/bsc-hons-in-software-engineering.html
CINEC,Faculty of Information Technology,English,Full Time,3 Years,"G.C.E. Advanced Level (Sri Lanka) with a minimum of three “S” passes from any subject stream, or Advanced Level (London) with a minimum of 3 “D” passes, or completion of the CINEC STEM Foundation Programme, or any other qualification equivalent to UK Level 3 acceptable to ARU. English language proficiency required: minimum grade “C” in O/L English or equivalent, IELTS overall 6.0 (no band below 5.5) or equivalent English qualification.
",Intermediate,"Rs.1,870,000.00",Colombo ,"Software Developer, Programmer, Network Administrator, Cloud Application Developer, Technical Support Engineer, Database Administrator, IT Consultant.
","BSc (Hons) Computer Science - Anglia Ruskin University (ARU), United Kingdom",https://www.cinec.edu/courses/bsc-hons-computer-science.html
CINEC,Faculty of Information Technology,English,Full Time,4 Years,"At least three (3) simple passes (S) in Physical Science stream or Engineering Technology stream in one and the same sitting at the G.C.E. (Advanced Level) Examination OR at least three (3) simple passes (S) in any stream in one and the same sitting at the G.C.E. (Advanced Level) Examination conducted by the Department of Examinations of Sri Lanka or equivalent qualification and a Credit pass (C) in Mathematics at the G.C.E. (Ordinary Level) Examination conducted by the Department of Examinations of Sri Lanka or equivalent qualification and the successful completion with a bridging programme approved by specified Authority OR at least three (3) simple passes (S) in any stream in one and the same sitting with a simple pass (S) for Information and Communication Technology, in any attempt at the G.C.E. (Advanced Level) Examination conducted by the Department of Examinations of Sri Lanka or equivalent qualification and a Credit pass (C) in Mathematics at the G.C.E. (Ordinary Level) Examination conducted by the Department of Examinations of Sri Lanka or equivalent qualification.
",Intermediate,"Rs. 2,200,000.00",Colombo ,"Network Security Engineer, Security Analyst, Network Administrator, Digital Forensics Analyst, IT Security Auditor, Network Security Architect, Network Manager
",BSc (Hons) in Computer Science in Network Security and Forensics - Ministry of Higher Education Approved,https://www.cinec.edu/courses/bsc-hons-in-computer-science-in-network-security-and-forensics.html
CINEC,Faculty of Information Technology,English,Full Time,3 Years,"GCE Advance Level (A/L) (Sri Lanka) minimum grades of three “S” passes from any subject stream or Advance Level minimum of 3D passes (London) OR CINEC STEM Foundation Programme OR any other qualification equivalent to UK Level 3 acceptable to UoW AND English Language requirement: Minimum grade C (Credit Pass) in English at the Sri Lankan O-levels Certificate (or equivalent), Minimum grade S (Simple Pass) for General English paper at the Sri Lankan Advance Level Examination, or any qualification internationally recognised as being at/equivalent to UK Level 3 or above which has been delivered and assessed in English. IELTS overall score of 6.0 or above (individual 5.5+), PTE minimum score 51, CAE/CPE pass, or full UK-accredited GCSE/GCE in English grade C or above.
",Intermediate,"Rs.1,915,000.00",Colombo ,"Software Developer, Programmer, Systems Engineer, Web Developer, Database Administrator, IT Security Specialist. Graduates gain strong software analysis and development knowledge, transferable skills, and business/entrepreneurial understanding. Eligible for professional body membership such as BCS, and can pursue Master’s degrees in SE, AI, CS, IT.
",BSc (Hons) Software Engineering - Anglia ,https://www.cinec.edu/courses/bsc-hons-software-engineering.html
CINEC,Faculty of Information Technology,English,Full Time,3 Years,"GCE Advance Level (A/L) (Sri Lanka) minimum grades of three “S” passes from any subject stream or Advance Level minimum of 3D passes (London), CINEC STEM Foundation Programme or any other qualification equivalent to UK Level 3 acceptable to UoW. AND English Language requirement: Minimum grade C (Credit Pass) in English at the Sri Lankan O-levels Certificate (or equivalent), Minimum grade S (Simple Pass) for General English paper at the Sri Lankan Advance Level Examination, Any qualification internationally recognised as being at/equivalent to UK Level 3 or above which has been delivered and assessed in English, IELTS overall score of 6.0 or above with individual scores of 5.5 or above, PTE minimum score of 51, A pass in the Cambridge Advanced English examination (CAE), A pass in the Cambridge Proficiency examination (CPE), Full UK-accredited GCSE or GCE in English Language grade C or above
",Intermediate,"Rs.1,915,000.00",Colombo ,"This course is designed for students to build the necessary skills to work in the development and applications of artificial intelligence while acquiring strong foundations in programming, computer systems, databases, and digital security. Collaborative projects, industry placements, and exposure to project management, research, and professional skills enhance employability. Graduates can pursue roles such as AI Developer, Data Analyst, Machine Learning Engineer, AI Researcher, or Software Engineer.
","BSc (Hons) Artificial Intelligence - Anglia Ruskin University (ARU), United Kingdom",https://www.cinec.edu/courses/bsc-hons-artificial-intelligence.html
CINEC,Faculty of Information Technology,English,Full Time,1 Years,"• Pearson BTECH HND in Computing with specialization in relevant field or
• Higher National Diploma and HND in relevant field from Sri Lanka Institute of Advance Technology (SLIATE) or
• BCS Diploma in IT with project or
• NVQ-6 qualification in relevant field awarded by University Colleges / Colleges of Technology in Sri Lanka
• Any other qualification equivalent to UK Level 5 in the relevant field acceptable to ARU.

AND
English Language requirement namely,
• Minimum grade C in English at the Sri Lankan O-levels Certificate (GCE O/L) (or equivalent).
• Minimum grade S for General English paper at the Sri Lankan Advance Level Examination (GCE A/L).
• Any qualification internationally recognised as being at/equivalent to UK Level 3 or above which has been delivered and assessed in English.
• An IELTS overall score of 6.0 or above with individual scores of 5.5 or above
• PTE minimum score of 51
",Intermediate,"Rs. 725,000.00",Colombo ,"Software Development, Internet and Cloud Applications, Network Administration, Technical Support, IT Project Management
","BSc (Hons) Applied Computer Science (TopUp) - Anglia Ruskin University (ARU), United Kingdom",https://www.cinec.edu/courses/bsc-hons-applied-computer-science-topup.html
KIU,Faculty of Computer Science and Engineering,English,Full Time,3–4 Years,"Completion of G.C.E A/L or equivalent in relevant streams; English proficiency required (O/L Credit in English or equivalent, IELTS 6.0+, PTE 51+). Additional requirements may apply based on program specialization.
",Advanced,,Colombo ,"Software Developer, Software Engineer, Systems Analyst, Project Manager, Application Developer, Quality Assurance Engineer, IT Consultant, Entrepreneur in Software Industry
",BSc (Hons) in Software Engineering,https://kiu.ac.lk/faculty/faculty-of-computer-science-engineering/
KIU,Faculty of Computer Science and Engineering,English,Full Time,3–4 Years,"Completion of G.C.E A/L or equivalent in relevant streams; English proficiency required (O/L Credit in English or equivalent, IELTS 6.0+, PTE 51+).
",Advanced,,Colombo ,"Network Administrator, Cybersecurity Analyst, Penetration Tester, Security Consultant, IT Auditor, Ethical Hacker, Security Systems Engineer
",BSc (Hons) in Computer Network and Cyber Security,https://kiu.ac.lk/faculty/faculty-of-computer-science-engineering/
KIU,Faculty of Computer Science and Engineering,English,Full Time,3–4 Years,"Completion of G.C.E A/L or equivalent in relevant streams; English proficiency required (O/L Credit in English or equivalent, IELTS 6.0+, PTE 51+).
",Advanced,,Colombo ,"Systems Analyst, Business Analyst, IT Manager, ERP Consultant, Data Analyst, Database Administrator, IT Project Manager
",BSc (Hons) in Management Information Systems,https://kiu.ac.lk/faculty/faculty-of-computer-science-engineering/
KIU,Faculty of Computer Science and Engineering,English,Full Time,3–4 Years,"Completion of G.C.E A/L or equivalent in relevant streams; English proficiency required (O/L Credit in English or equivalent, IELTS 6.0+, PTE 51+).
",Advanced,,Colombo ,"Data Analyst, Data Scientist, Machine Learning Engineer, AI Specialist, Business Intelligence Analyst, Big Data Engineer
",BSc (Hons) in Data Science,https://kiu.ac.lk/faculty/faculty-of-computer-science-engineering/
KIU,Faculty of Behavioural Sciences,English,Full Time,3–4 Years,"Completion of G.C.E A/L or equivalent; English proficiency required (O/L Credit in English or equivalent, IELTS 6.0+, PTE 51+). Practical training or fieldwork may be required as part of curriculum.
",Advanced,,Colombo ,"Clinical Psychologist, Counselor, HR Specialist, Researcher, Educational Psychologist, Social Services Specialist, Academic
",BSc (Hons) in Psychology,https://kiu.ac.lk/faculty/faculty-of-behavioural-sciences/
SLTC,Faculty of Business Management,English,Full Time,4 Years,"Three (3) simple passes (S) in the Commerce Stream, including Accounting, in one and the same sitting at the G.C.E. A/L Examination conducted by the Department of Examinations of Sri Lanka or an equivalent qualification; OR three (3) simple passes (S) in any stream at G.C.E. A/L, AND a Credit (C) pass in Mathematics and Business & Accounting Studies at G.C.E. O/L or equivalent.
",Intermediate,,Padukka,"Accountant, Auditor, Financial Analyst, Investment Banker, Tax Consultant, Risk Manager, Finance Executive, Compliance Officer, Entrepreneur, Business Consultant
",Accounting and Finance,https://sltc.ac.lk/courses/bbm-hons-in-accounting-and-finance/
